id,avail,name,icon,photo,text,topic,overallPriority,foodPriority,populationPriority,ecosystemPriority,setX,setY,illustratorX,illustratorY,calcX,calcY,oldX,oldY
M,n,What is soil?,./tree.png,test.png,Learn more about soil,soil,,3,,,0.138076923,0.115555556,120,52,107.7,46.5,0.1,0.1
N,n,Soil ecosystem,./tree.png,test.png,"Soil is a complex ecosystem, with global impacts",environmental,,3,,,0.110512821,0.164444444,96,74,86.2,66.2,0.2,0.1
O,n,Where does soil come from?,./tree.png,test.png,How soil is created,soil,,3,,,0.094358974,0.275555556,82,124,73.6,110.9,0.3,0.1
A,n,Soil and food,./tree.png,test.png,All of the world's food comes from the soil,food,,3,,,0.092051282,0.4,80,180,71.8,161,0.3,0.1
B,n,What people eat,./tree.png,test.png,Diets vary across cultures and over time,food,,3,,,0.08974359,0.5,78,225,70,201.3,0.1,0.3
P,n,Plant needs,./images/plant_sm.png,test.png,What plants need to grow,soil,,3,,,0.142692308,0.544444444,124,245,111.3,219.2,0.5,0.3
C,n,How much people eat,./tree.png,test.png,People eat more now than ever before,food,,3,,,0.112692308,0.655555556,98,295,87.9,263.9,0.15,0.4
Q,n,Soil biodiversity,./tree.png,test.png,A quarter of the world's species live in the soil,soil,,3,,,0.20025641,0.706666667,174,318,156.2,284.5,0.6,0.4
K,y,World population,./tree.png,test.png,World population has increased dramatically in the past century,population,,3,1,,0.062179487,0.888888889,54,400,48.5,357.9,0.15,0.2
D,n,Food flow,./tree.png,./images/foodflow_sm.png,Food is a global issue,food,,1,,,0.102435897,0.808888889,89,364,79.9,325.6,0.2,0.3
G,y,Land per person,./tree.png,test.png,The land needed to feed one person is decreasing,food,,1,,,0.167948718,0.826666667,146,372,131,332.8,0.1,0.6
T,y,Climate change,./tree.png,./images/globalC_sm.png,Soil stores carbon and can help to mitigate climate change,environmental,,3,,,0.269230769,0.762222222,234,343,210,306.9,0.9,0.75
E,n,Food demands,./tree.png,test.png,World food supply needs are growing,population,,3,,,0.124230769,0.913333333,108,411,96.9,367.7,0.3,0.4
F,y,People per farmer,./tree.png,test.png,Modern agriculture allows one farmer to feed more people now than ever before,food,,1,,,0.276153846,0.875555556,240,394,215.4,352.5,0.7,0.4
H,y,Soil degradation,./tree.png,test.png,Meeting food demands has caused loss of soil fertility,environmental,,2,,,0.399230769,0.8,347,360,311.4,322.1,0.75,0.6
L,n,Land use,./tree.png,test.png,Changes in land use directly affect soil quality,soil,,3,2,,0.396923077,0.966666667,345,435,309.6,389.2,0.7,0.7
R,n,Soil quality,./tree.png,test.png,What factors affect soil quality?,soil,,3,,,0.500512821,1.053333333,435,474,390.4,424.1,0.8,0.6
S,n,Soil fertility,./tree.png,test.png,Plants need soil organic carbon,soil,,3,,,0.636282051,1.04,553,468,496.3,418.7,0.85,0.65
I,n,Threats to the soil,./tree.png,test.png,"Current threats to the world's soil, according to the FAO-UNESCO",environmental,,2,,,0.727179487,1.006666667,632,453,567.2,405.3,0.8,0.8
J,n,Responses,./tree.png,test.png,Recommendations for protecting the soil,soil,,2,,,0.836410256,1.035555556,727,466,652.4,416.9,0.82,0.8
